{
  "$schema": "https://json-schema.org/draft/2020-12/schema",
  "$id": "https://schemas.multicloud-network-mcp.dev/schemas/v1/response-envelope.schema.json",
  "$comment": "GENERATED -- do not hand-edit. Produced by scripts/generate_schemas.py from multicloud_network_mcp.contracts.models.ResponseEnvelope (contract version 1.0.0). Edit the Pydantic model and re-run the script instead.",
  "$defs": {
    "CloudScope": {
      "description": "Where a fact was observed: which provider, which tenancy\nboundary, which geography, and when. Every field beyond ``provider``\nand ``collected_at`` is optional because no single provider\npopulates all of them -- see the field-by-field mapping below and\n``docs/normalization.md``.\n\n- ``tenant_id``: Azure AD tenant. Rarely meaningful for AWS/GCP.\n- ``account_id``: AWS account ID (12 digits).\n- ``subscription_id``: Azure subscription GUID.\n- ``project_id``: GCP project ID.\n- ``resource_group``: Azure resource group -- kept as its own field\n  (not folded into ``extensions``) because Azure resource identity is\n  genuinely incomplete without it, unlike a merely-supplementary fact.\n- ``region``: AWS/GCP-style region (``us-east-1``/``us-central1``).\n- ``location``: Azure's own term for the same granularity (ARM\n  responses literally use the JSON field name ``location``, not\n  ``region``) -- kept as a separate field rather than aliased onto\n  ``region``, since forcing Azure's ``location`` string into a field\n  named ``region`` would misrepresent which provider vocabulary it\n  came from.\n- ``zone``: availability-zone-level granularity, when the provider\n  exposes it (AWS AZ, Azure zone number, GCP zone).\n- ``collected_at``: ISO 8601 UTC timestamp this scope's data was\n  observed at -- never a live/real-time value.",
      "properties": {
        "provider": {
          "$ref": "#/$defs/Provider"
        },
        "tenant_id": {
          "anyOf": [
            {
              "type": "string"
            },
            {
              "type": "null"
            }
          ],
          "default": null,
          "title": "Tenant Id"
        },
        "account_id": {
          "anyOf": [
            {
              "type": "string"
            },
            {
              "type": "null"
            }
          ],
          "default": null,
          "title": "Account Id"
        },
        "subscription_id": {
          "anyOf": [
            {
              "type": "string"
            },
            {
              "type": "null"
            }
          ],
          "default": null,
          "title": "Subscription Id"
        },
        "project_id": {
          "anyOf": [
            {
              "type": "string"
            },
            {
              "type": "null"
            }
          ],
          "default": null,
          "title": "Project Id"
        },
        "resource_group": {
          "anyOf": [
            {
              "type": "string"
            },
            {
              "type": "null"
            }
          ],
          "default": null,
          "title": "Resource Group"
        },
        "region": {
          "anyOf": [
            {
              "type": "string"
            },
            {
              "type": "null"
            }
          ],
          "default": null,
          "title": "Region"
        },
        "location": {
          "anyOf": [
            {
              "type": "string"
            },
            {
              "type": "null"
            }
          ],
          "default": null,
          "title": "Location"
        },
        "zone": {
          "anyOf": [
            {
              "type": "string"
            },
            {
              "type": "null"
            }
          ],
          "default": null,
          "title": "Zone"
        },
        "collected_at": {
          "title": "Collected At",
          "type": "string"
        }
      },
      "required": [
        "provider",
        "collected_at"
      ],
      "title": "CloudScope",
      "type": "object"
    },
    "CollectionWarning": {
      "description": "A non-fatal issue collecting one resource type/scope -- a\ndisabled API, a missing IAM/RBAC permission, an unreachable\nregion/scope, a bounded fan-out cap reached. Identical in spirit to\nwhat all three cloud repos already call ``CollectionWarning``;\nunified here into one shape.\n\n``resource_type`` is free text (not the closed ``ResourceType``\nenum) because a warning can legitimately be about something outside\nthis contract's 19 canonical resource kinds (e.g. a Shared VPC host\nstatus lookup, a metrics query) -- ``resource_type_hint`` is set\nwhen the warning genuinely does concern one of the canonical types,\nfor a consumer that wants to filter/aggregate by it.\n\nA disabled API or missing permission must never be silently treated\nas \"this scope has zero resources of this type\" -- it must surface\nhere instead. See ``docs/normalization.md``'s partial-result\nguardrail and ``tests/contracts/test_partial_collections.py``.",
      "properties": {
        "resource_type": {
          "title": "Resource Type",
          "type": "string"
        },
        "resource_type_hint": {
          "anyOf": [
            {
              "type": "string"
            },
            {
              "type": "null"
            }
          ],
          "default": null,
          "title": "Resource Type Hint"
        },
        "code": {
          "title": "Code",
          "type": "string"
        },
        "message": {
          "title": "Message",
          "type": "string"
        },
        "scope": {
          "anyOf": [
            {
              "$ref": "#/$defs/CloudScope"
            },
            {
              "type": "null"
            }
          ],
          "default": null
        }
      },
      "required": [
        "resource_type",
        "code",
        "message"
      ],
      "title": "CollectionWarning",
      "type": "object"
    },
    "Completeness": {
      "enum": [
        "complete",
        "partial"
      ],
      "title": "Completeness",
      "type": "string"
    },
    "ErrorDetail": {
      "description": "Normalized, client-safe error detail -- never a stack trace or\nraw provider exception repr. ``provider_error_code`` preserves the\nprovider's own error code/type string (e.g. botocore's\n``AccessDenied``, an ARM error code, a ``google.api_core.exceptions``\nclass name) for a consumer that wants provider-specific handling\nwithout this contract needing to enumerate every provider's error\ntaxonomy.",
      "properties": {
        "type": {
          "title": "Type",
          "type": "string"
        },
        "message": {
          "title": "Message",
          "type": "string"
        },
        "provider_error_code": {
          "anyOf": [
            {
              "type": "string"
            },
            {
              "type": "null"
            }
          ],
          "default": null,
          "title": "Provider Error Code"
        }
      },
      "required": [
        "type",
        "message"
      ],
      "title": "ErrorDetail",
      "type": "object"
    },
    "PaginationMetadata": {
      "description": "Present only on a response whose ``data`` is a bounded/paginated\ncollection. ``next_cursor`` is opaque and provider-defined --\nmeaningful only to the same tool that issued it, never something\nthis contract parses or constructs itself (each cloud repo's own\npagination internals stay entirely its own concern; this contract\nonly standardizes how \"there was more, here's how much we returned,\nand whether it was capped\" is reported).",
      "properties": {
        "returned_items": {
          "title": "Returned Items",
          "type": "integer"
        },
        "max_items": {
          "anyOf": [
            {
              "type": "integer"
            },
            {
              "type": "null"
            }
          ],
          "default": null,
          "title": "Max Items"
        },
        "truncated": {
          "default": false,
          "title": "Truncated",
          "type": "boolean"
        },
        "next_cursor": {
          "anyOf": [
            {
              "type": "string"
            },
            {
              "type": "null"
            }
          ],
          "default": null,
          "title": "Next Cursor"
        }
      },
      "required": [
        "returned_items"
      ],
      "title": "PaginationMetadata",
      "type": "object"
    },
    "PartialResultMetadata": {
      "description": "Whether a response reflects everything the requested scope\nactually contains, or only what could be collected. ``completeness``\nis ``PARTIAL`` whenever ``warnings`` is non-empty -- enforced here at\nconstruction time (raises ``ValueError``, not just a documented\nconvention a caller could violate by mistake); see\n``tests/contracts/test_partial_collections.py``.",
      "properties": {
        "completeness": {
          "$ref": "#/$defs/Completeness",
          "default": "complete"
        },
        "warnings": {
          "items": {
            "$ref": "#/$defs/CollectionWarning"
          },
          "title": "Warnings",
          "type": "array"
        }
      },
      "title": "PartialResultMetadata",
      "type": "object"
    },
    "Provider": {
      "enum": [
        "aws",
        "azure",
        "gcp"
      ],
      "title": "Provider",
      "type": "string"
    }
  },
  "description": "The standard wrapper every normalized-export MCP tool call\nreturns. ``request_id`` correlates one call with its logs; distinct\nfrom any resource's own ``urn``.",
  "properties": {
    "success": {
      "title": "Success",
      "type": "boolean"
    },
    "tool": {
      "title": "Tool",
      "type": "string"
    },
    "contract_version": {
      "title": "Contract Version",
      "type": "string"
    },
    "request_id": {
      "title": "Request Id",
      "type": "string"
    },
    "scope": {
      "$ref": "#/$defs/CloudScope"
    },
    "data": {
      "anyOf": [
        {},
        {
          "type": "null"
        }
      ],
      "default": null,
      "title": "Data"
    },
    "pagination": {
      "anyOf": [
        {
          "$ref": "#/$defs/PaginationMetadata"
        },
        {
          "type": "null"
        }
      ],
      "default": null
    },
    "partial_result": {
      "anyOf": [
        {
          "$ref": "#/$defs/PartialResultMetadata"
        },
        {
          "type": "null"
        }
      ],
      "default": null
    },
    "error": {
      "anyOf": [
        {
          "$ref": "#/$defs/ErrorDetail"
        },
        {
          "type": "null"
        }
      ],
      "default": null
    }
  },
  "required": [
    "success",
    "tool",
    "contract_version",
    "request_id",
    "scope"
  ],
  "title": "ResponseEnvelope",
  "type": "object"
}
