{
  "success": true,
  "tool": "aws_get_network",
  "contract_version": "1.0.0",
  "request_id": "7c9b0e2a-1f3d-4a5e-9c2b-6d8f0a1b2c3d",
  "scope": {
    "provider": "aws",
    "tenant_id": null,
    "account_id": "123456789012",
    "subscription_id": null,
    "project_id": null,
    "resource_group": null,
    "region": "us-east-1",
    "location": null,
    "zone": null,
    "collected_at": "2026-08-28T12:00:00Z"
  },
  "data": {
    "extensions": {
      "aws": {
        "is_default": false,
        "instance_tenancy": "default",
        "dhcp_options_id": "dopt-0123456789abcdef0",
        "enable_dns_support": true,
        "enable_dns_hostnames": true
      }
    },
    "urn": "urn:mcnet:v1:aws:account_id=123456789012,region=us-east-1:network:vpc-0abc123def456789",
    "native_id": "vpc-0abc123def456789",
    "resource_type": "network",
    "provider": "aws",
    "scope": {
      "provider": "aws",
      "tenant_id": null,
      "account_id": "123456789012",
      "subscription_id": null,
      "project_id": null,
      "resource_group": null,
      "region": "us-east-1",
      "location": null,
      "zone": null,
      "collected_at": "2026-08-28T12:00:00Z"
    },
    "name": "prod-vpc",
    "tags": {
      "Name": "prod-vpc",
      "Environment": "production"
    },
    "observed_at": "2026-08-28T12:00:00Z",
    "source_api": "ec2:DescribeVpcs",
    "collection_completeness": "complete",
    "cidr_blocks": [
      "10.0.0.0/16"
    ],
    "ipv6_cidr_blocks": [],
    "dns_servers": [],
    "mtu": null,
    "state": "available"
  },
  "pagination": null,
  "partial_result": {
    "completeness": "complete",
    "warnings": []
  },
  "error": null
}
